texto,clase,tipo,origen,
"Se calcula que la antigüedad del universo es de 13,500 millones de años[1] y la de la Tierra es de cinco mil millones de años[2]. La presencia del Homo Sapiens[3], el abuelo más cercano al hombre contemporáneo en la tierra, es de aproximadamente 150 mil años. Para dimensionar la antigüedad de la Tierra y su relación con la del ser humano; podríamos suponer que si los cinco mil millones de años que tienen de existir el planeta fueran un año. El ser humano habría aparecido en ese año, el 31 de diciembre a las 23 horas, con 59 minutos. Es decir, que la humanidad es tan sólo un ""instante"", en la vida de este maravilloso, espléndido y generoso ser vivo que es la Tierra. Sin embargo, en una millonésima fracción de segundo, es decir, en los últimos 50 años los seres humanos estamos poniendo en peligro de muerte a la misma Tierra por nuestra equivocada forma de vivir.",humano,ensayo,https://es.wikisource.org/wiki/Historia_Verdadera_del_M%C3%A9xico_Profundo/1,
"VIVIAN.- ¡Gozar de la Naturaleza! Antes que nada quiero que sepa que he perdido esa facultad por completo. Dicen las personas que el Arte nos hace amar aún más a la Naturaleza, que nos revela sus secretos y que una vez estudiados estos concienzudamente, según afirman Corot y Constable, descubrimos en ella cosas que antes escaparon a nuestra observación. A mi juicio, cuanto más estudiamos el Arte, menos nos preocupa la Naturaleza. Realmente lo que el Arte nos revela es la falta de plan de la Naturaleza, su extraña tosquedad, su extraordinaria monotonía, su carácter completamente inacabado. La Naturaleza posee, indudablemente, buenas intenciones; pero como dijo Aristóteles hace ya tiempo que no puede llevarlas a cabo. Cuando miro un paisaje, me es imposible dejar de ver todos sus defectos. A pesar de lo cual, es una suerte para nosotros que la Naturaleza sea tan imperfecta, ya que de no ser así no existiría el Arte. El Arte es nuestra enérgica protesta, nuestro valiente esfuerzo para enseñar a la naturaleza cuál es su verdadera función. En cuanto a eso de la infinita variedad de la Naturaleza, no es más que un mito. La variedad no se puede encontrar en la Naturaleza misma, sino en la imaginación, en la fantasía o en la ceguera cultivada de su observador.",humano,ensayo,https://es.wikisource.org/wiki/La_decadencia_de_la_mentira,
"¡Eternamente bello ese arco triunfal del suelo americano! Parece que el mar hubiera sido atraído a aquella ensenada por un canto irresistible y que, al besar el pie de esas montañas cubiertas de bosques, al reflejar en sus aguas los árboles del trópico y los elegantes contornos de los cerros, cuyas almas dibujan sobre un cielo profundo y puro, líneas de una delicadeza exquisita, el mismo océano hubiera sonreído desarmado, perdiendo su ceño adusto, para caer adormecido en el seno de la armonía que lo rodeaba. Jamás se contempla sin emoción ese cuadro, y no se concibe cómo los hombres que viven constantemente con ese espectáculo al frente, no tengan el espíritu modelado para expresar en altas ideas todas las cosas grandes del cielo y de la tierra. Tal así, la naturaleza helénica, con sus montañas armoniosas y serenas, como la marcha de un astro, su cielo azul y transparente, las aguas generosas de sus golfos, que revelan los secretos todos de su seno, arrojó en el alma de los griegos ese sentimiento inefable del ideal, esa concepción sin igual de la belleza, que respira en las estrofas de sus poetas y se estremece en las líneas de sus mármoles esculpidos. Pero el suelo de la Grecia está envuelto, como en un manto cariñoso, por una atmósfera templada y sana, que excita las fuerzas físicas y da actividad al cerebro. Sobre las costas que baña la bahía de Río de Janeiro, el sol cae a plomo en capas de fuego, el aire corre abrasado, los despojos de una vegetación lujuriosa fermentan sin reposo y la savia de la vida se empobrece en el organismo animal.",humano,ensayo,https://es.wikisource.org/wiki/La_Bah%C3%ADa_de_R%C3%ADo_de_Janeiro,
"Estas razones justifican, a mi ver, la inclusión de la Celestina en el cuadro que venimos bosquejando. Y admitida ella, que es sin duda la más dramática, no puede prescindirse de sus imitaciones, que lo son mucho menos, a excepción de la Selvagia, la Lena y alguna otra. Aun estas mismas fueron escritas sin contar para nada con la escena; y no lo digo solamente por las situaciones pecaminosas, pues iguales, ya que no peores, las hay en varias comedias italianas que positivamente fueron representadas, sino porque en todas esas imitaciones falta aquella chispa de genio dramático que inflama la creación del bachiller Rojas y la hace bullir y moverse ante nuestros ojos en un escenario ideal. En las Celestinas secundarias, el diálogo, aunque constantemente puro y rico de idiotismos y gracias de lenguaje, camina lento y monótono, se pierde en divagaciones hinchadas y pedantescas o se revuelca en los más viles lodazales. Sus autores calcan servilmente los tipos ya creados, pero rara vez aciertan a hacerles hablar su propio y adecuado lenguaje. Del drama sólo conservan la exterior corteza, la división en actos o escenas, pero introducen largas narraciones, se enredan en episodios inconexos y usan procedimientos muy afines a los de la novela. Algunas hasta carecen de verdadera acción. La Lozana Andaluza, por ejemplo, no es comedia ni novela, sino una serie de diálogos escandalosos, del mismo corte y jaez que los Ragionamenti del Aretino. Pero de los caracteres que distinguen a algunos de estos libros y les dan peculiar fisonomía se hablará en el capítulo que sigue. Ahora debemos atender sólo a la obra primitiva, que por ningún concepto debe mezclarse con su equívoca y harto dilatada parentela.",humano,ensayo,https://es.wikisource.org/wiki/La_Celestina:_Razones_01,
"Para situar a Góngora hay que hacer notar los dos grupos de poetas que luchan en la Historia de la Lírica de España. Los poetas llamados populares e impropiamente nacionales, y los poetas llamados propiamente cultos o cortesanos. Gentes que hacen su poesía andando los caminos o gentes que hacen su poesía sentados en su mesa, viendo los caminos a través de los vidrios emplomados de la ventana. Mientras que en el siglo XIII los poetas indígenas, sin nombre, balbucean canciones, desgraciadamente perdidas, del sentimiento medieval galaico o castellano, el grupo que vamos a llamar contrario, para distinguirlo, atiende a la francesa y provenzal. Bajo aquel húmedo cielo de oro se publican las canciones de Ajuda y de la Vaticana, donde oímos a través de las rimas provenzales del rey don Dionís y de las cultas canciones de amigo o cantigas de amor, seguramente por olvido de la firma, tan respetada en la Edad Media, la tierna voz de los poetas sin nombre, que cantan un puro canto, exento de gramática.",humano,ensayo,https://es.wikisource.org/wiki/La_imagen_po%C3%A9tica_de_Luis_de_G%C3%B3ngora,
"No hace mucho, en una conferencia, sentí que el expositor había escogido conceptos demasiado ajenos para él, y por eso no logró interesarme en el tema tanto como habría podido. Las cosas que describía no eran cercanas a su esencia, sino alejadas y superficiales. No había, por lo tanto, un planteamiento central en su exposición; hubiera sido mejor que él hablara desde sus propias experiencias, como lo hacen los poetas. El favor más grande que me han hecho es cuando me han preguntado lo que ""yo pienso"", y han escuchado mi respuesta. Me sorprende y me agrada cuando esto pasa ya que es un uso poco corriente de uno mismo, como si estuvieran familiarizados con el ""instrumento"". En general cuando alguien esta interesado en mí es sólo para saber cuantos acres he medido de su tierra - soy un topógrafo - o a lo sumo se interesan en las noticias triviales que cargo. No buscan el alimento; se conforman con la cáscara. Una vez me pidieron una conferencia sobre la esclavitud, pero en realidad me di cuenta de que querían intervenir mi conferencia con sus propios postulados, dejándome una mínima parte a mí, así es que no acepté. Tengo como premisa, cuando me invitan a una conferencia en otro lado, que exista el deseo de oír lo que ""yo pienso"" sobre alguna materia, aunque pase por ignorante; pero nunca diré cosas ""agradables"" o complacientes con la audiencia. Tengo resuelto que les daré una fuerte dosis de mi mismo. Me han enviado llamar y se han comprometido a pagarme, yo iré aunque los aburra sin precedentes.",humano,ensayo,https://es.wikisource.org/wiki/La_vida_sin_fundamentos,
"Lo anterior trae como consecuencia que al leer una obra literaria se impone una lectura en muchos niveles. La comunicación literaria no es directa ni sencilla, sino ambigua y compleja. Exige un esfuerzo por parte del lector. Sin embargo, existe una literatura de gran consumo que al ofrecer escasa connotación y limitarse a presentar estereotipos de fácil acceso, seduce a los públicos y vence a las grandes obras de la literatura en cuanto a su mayor número de lectores. Tales obras llamadas de “subliteratura” no crean sistemas novedosos de significaciones y al basarse en sistemas sígnicos aceptados por todos, resultan exitosas y restan el acercamiento a las obras trascendentales de la literatura. Novelas de temática amorosa o policiaca que repiten arquetipos, clisés literarios, estructuras sencillas, enredan con su intrascendencia a un público enajenado y lo entretienen, lo distraen de los grandes problemas humanos, como para que no se den cuenta de los tejemanejes económico-políticos a los que se hallan sujetos.",humano,ensayo,https://es.wikisource.org/wiki/Literaturidad#Hablemos,
"La prensa mitrista llama ""descamisados"" a todos los que no son partidarios de su ídolo. Esa prensa podrá reconocer la pobreza de los individuos que insulta, que son argentinos, que tienen derecho a participar de las conmociones de su patria y a concurrir para la formación de sus poderes. Pero si los individuos del pueblo que van a dar en tierra con el poder y con la influencia del caudillo y la aristocracia son descamisados, ¿quién les habrá robado la camisa? ¿Por qué, siendo argentinos, se encuentran desheredados en su propia Patria?. Los que ahora nos insultan llamándonos descamisados, quizás viven en suntuosos palacios o en casas regaladas que se compran con el dinero que se cercenó a nuestro salario. Quizá los que después de habernos desnudado se ríen de nuestra desnudez, se visten lujosamente con el dinero que la Nación había destinado para que fuéramos bien alimentados en las campañas, y para que no entráramos hambrientos a las batallas, donde debíamos llenar los deberes del soldado para sostener la grande y ruinosa política. Quizás los que insultan a los pobres trabajadores del pueblos señalándoles su miseria, han conseguido conducirlos a ella, destruyéndoles su familia al arrebatar del hogar al que la mantenía; quizá el descamisado que recorre las pulperías consumiendo lo que gana en el día es conducido a la abyección y a la miseria por los que le hicieron abandonar a sus hijos y a su esposa imponiéndoles la ración de hambre y desolación que quita todo los encantos de la vida.",humano,ensayo,https://es.wikisource.org/wiki/Los_descamisados,
"Lector mío, seas quien fueres, no te espero muy propicio, porque siendo verosímil que estés preocupado de muchas de las opiniones comunes que impugno, y no debiendo yo confiar tanto, ni en mi persuasiva ni en tu docilidad, que pueda prometerme conquistar luego tu asenso, ¿qué sucederá sino que, firme en tus antiguos dictámenes, condenes como inicuas mis decisiones? Dijo bien el padre Malebranche que aquellos autores que escriben para desterrar preocupaciones comunes no deben poner duda en que recibirá el público con desagrado sus libros. En caso que llegue a triunfar la verdad, camina con tan perezosos pasos la victoria, que el autor, mientras vive, sólo goza el vano consuelo de que le pondrán la corona de laurel en el túmulo. Buen ejemplo es del famoso Guillermo Harveo, contra quien, por el noble descubrimiento de la circulación de la sangre, declamaron furiosamente los médicos de su tiempo, y hoy le veneran todos los profesores de la Medicina como oráculo. Mientras vivió le llenaron de injurias, ya muerto, no les falta sino colocar su imagen en las aras.",humano,ensayo,https://es.wikisource.org/wiki/Teatro_cr%C3%ADtico_universal/Pr%C3%B3logo_al_lector,
"Son condiciones esenciales de toda traducción fiel en verso —por lo que respecta al proceder mecánico— tomar por base de la estructura el corte de la estrofa en que la obra está tallada; ceñirse a la misma cantidad de versos, y encerrar dentro de sus líneas precisas las imágenes con todo su relieve, con claridad las ideas, y con toda su gracia prístina los conceptos; adoptar un metro idéntico o análogo por el número y acentuación, como cuando el instrumento acompaña la voz humana en su medida, y no omitir la inclusión de todas las palabras esenciales que imprimen su sello al texto, y que son, en los idiomas, lo que los equivalentes en química y geometría. En cuanto a la ordenación literaria, debe darse a los vuelos iniciales de la imaginación toda su amplitud o limitarlos correctamente con la ordenación originaria; imprimir a los giros de la frase un movimiento propio, y al estilo su espontánea simplicidad o la cualidad característica que lo distinga; y cuando se complemente con algún adjetivo o explanación la frase, hacerlo dentro de los limites de la idea matriz. Por último, tomando en cuenta el ideal, el traductor, en su calidad de intérprete, debe penetrarse de su espíritu, como el artista que, al modelar en arcilla una estatua, procura darle no sólo su forma externa, sino también la expresión reveladora de la vida interna.",humano,ensayo,https://es.wikisource.org/wiki/Teor%C3%ADa_del_traductor,
"Damos en el presente número el retrato del alcalde y presidente del Ayuntamiento popular de Madrid, don Nicolás María Rivero, reelegido por aclamación para tan importante cargo, en el año que comienza, y en cuyo puesto, desde los primeros dias de la revolución, ha venido prestando señaladísimos servicios. No pudiendo extendernos á hacer una biografía completa de este patricio distinguido, nos limitaremos á presentarle bajo el aspecto principal de su vida pública en sus tres fases de jurisconsulto, orador y hombre político. En este último concepto, sabido es que no podría escribirse la historia de la organización de la democracia española, y de su activa propaganda comenzada ostensiblemente en 1849, sin reconocer en todos sus períodos la acción enérgica, la inteligente dirección y la gran perseverancia del señor Rivero, que en la prensa, en las academias, en el parlamento, de palabra y por escrito, en la lucha violenta de las armas y en el palenque de la discusión pacífica, siempre se halló en la brecha, manteniendo, con varonil elocuencia, y con tanta entereza como tenacidad, los derechos naturales del hombre, que son el fon do esencial del dogma democrático.",humano,ensayo,https://es.wikisource.org/wiki/Rivero,
"Aquel enjambre humano debía presentar a vuelo de pájaro el aspecto de un basurero. Los sombreros mugrientos, los forros encarnados de las ruanas, los pañolones oscuros y sebosos, los paraguas apabullados, tantos pañuelos y trapajos retumbantes, eran el guardarropa de un Arlequín. Animadísima estaba la feria: era primer domingo de mes y el vecindario todo había acudido a renovación. Destellaba un sol de justicia; en las tasajeras de carne, de esa carne que se acarroñaba al resistero, buscaban las moscas donde incubar sus larvas; en los tendidos de cachivaches se agrupaban las muchachas campesinas, sudorosas y sofocadas, atraídas por la baratija, mientras las magnatas sudaban el quilo, a regateo limpio, entre los puestos de granos, legumbres y panela. Ese olor de despensa, de carnicería, de transpiración de gentes, de guiñapos sucios mezclado al olor del polvo y al de tanta plebe y negrería, formaban sumados, la hediondez genuina, paladinamente manifestada, de la humanidad. Los altercados, los diálogos, las carcajadas, el chillido, la rebatiña vertiginosa de la venduta, componían, sumados también, el balandro de la bestia. Llenaba todo el ámbito del lugarón.",humano,cuento,https://es.wikisource.org/wiki/A_la_plata,
"Raciocinemos, pues, o divaguemos, que en cierto modo viene a ser una misma operación mental. He dicho que la libertad es un principio esencial, coexistente con la organización humana. Pero es un principio malo, muy malo; esto lo ha descubierto el hombre mismo, a juzgar por todo lo que ha hecho para suprimirlo, ya en forma de formas de gobierno, ya de cultura codificada, ya, en fin, de moralidades más o menos religiosas. Y ésa es una prueba de que la libertad es una cosa mala. No sé cuántos siglos llevamos vividos, pero sí sé que todos ellos se han empleado en perseguir eso que se llama libertad. A veces el mal principio, le llamaremos así, ha crecido, ha crecido tanto, que los pueblos no han podido menos que hacerse sus instrumentos, y fingiendo un santo ardor por eso, llamado entonces la causa de la libertad, han parecido heroicos, sublime y han levantado cadalsos para... los otros, los que no sentían ese mismo fuego sagrado; han cortado la cabeza a unos cuantos reyes; del pueblo mismo, no se diga, - porque pueblo quiere decir en lenguaje de... este día, es decir, pronunciado con antifaz, para que lo crean mentira - ; una fuente de agua roja llamada vulgarmente sangre, para regar los campos, las calles y los palacios, cuando se enojan los gobiernos con los que no los quieren, o cuando éstos se enojan porque los otros se demoran mucho en el poder; también se da ese nombre a la colectividad de los que pagan por hacerse ricos; otros llamados comúnmente administradores de la cosa pública, es decir, del pueblo, - lo repito porque es lo más frecuentemente olvidado - ; esto, llamado así, ocupa el nivel común de las cosas, es la base de todo, base, entiéndase bien, porque sirve para poner sobre sus espaldas todo, porque es una cosa muy dura u resistente. Así es también sensible a veces, como si tuviera un alma sola y grande. Hay palabras que lo conmueven y lo levantan en masa, y entonces, ¡Dios nos libre!, mejor dicho, ¡libre Dios a los enemigos de la patria...!",humano,cuento,https://es.wikisource.org/wiki/A_solas_con_mi_demonio,
"Abuelita es muy vieja, tiene muchas arrugas y el pelo completamente blanco, pero sus ojos brillan como estrellas, sólo que mucho más hermosos, pues su expresión es dulce, y da gusto mirarlos. También sabe cuentos maravillosos y tiene un vestido de flores grandes, grandes, de una seda tan tupida que cruje cuando anda. Abuelita sabe muchas, muchísimas cosas, pues vivía ya mucho antes que papá y mamá, esto nadie lo duda. Tiene un libro de cánticos con recias cantoneras de plata; lo lee con gran frecuencia. En medio del libro hay una rosa, comprimida y seca, y, sin embargo, la mira con una sonrisa de arrobamiento, y le asoman lágrimas a los ojos. ¿Por qué abuelita mirará así la marchita rosa de su devocionario? ¿No lo sabes? Cada vez que las lágrimas de la abuelita caen sobre la flor, los colores cobran vida, la rosa se hincha y toda la sala se impregna de su aroma; se esfuman las paredes cual si fuesen pura niebla, y en derredor se levanta el bosque, espléndido y verde, con los rayos del sol filtrándose entre el follaje, y abuelita vuelve a ser joven, una bella muchacha de rubias trenzas y redondas mejillas coloradas, elegante y graciosa; no hay rosa más lozana, pero sus ojos, sus ojos dulces y cuajados de dicha, siguen siendo los ojos de abuelita.",humano,cuento,https://es.wikisource.org/wiki/Abuelita_(Andersen),
"En un recinto estrecho, entre paredes llenas de hollín, negras, muy negras, trabajaban unos hombres en la forja. Uno movía el fuelle que resoplaba, haciendo crepitar el carbón, lanzando torbellinos de chispas y llamas como lenguas pálidas, áureas, azulejas, replandecientes. Al brillo del fuego en que se enrojecían largas barras de hierro, se miraban los rostros de los obreros con un reflejo trémulo. Tres yunques ensamblados en toscas armazones resistían el batir de los machos que aplastaban el metal candente, haciendo saltar una lluvia enrojecida. Los forjadores vestían camisas de lana de cuellos abiertos, y largos delantales de cuero. Alcanzábaseles a ver el pescuezo gordo y el principio del pecho velludo; y salían de las mangas holgadas los brazos gigantescos, donde, como en los de Amico, parecían los músculos redondas piedras de las que deslavan y pulen los torrentes. En aquella negrura de caverna, al resplandor de las llamaradas, tenían tallas de cíclopes. A un lado, una vantanilla dejaba pasar apenas un haz de rayo de sol. A la entrada de la forja, como en un marco oscuro, una muchacha blanca comía uvas. Y sobre aquel fondo de hollín y de carbón, sus hombros delicados y tersos que estaban desnudos, hacían resaltar su bello color de lis, con un casi imperceptible tono dorado.",humano,cuento,https://es.wikisource.org/wiki/Aguafuerte,
